comedian,full_name,country,bio,birth_year
Paul F. Tompkins,Paul Francis Tompkins,USA,"Paul Francis Tompkins (born c. 1967/1968), best known as Paul F. Tompkins, is an American comedian, actor and writer. He is known for his work in television on such programs as Mr. Show with Bob and David, Real Time with Bill Maher and Best Week Ever, later renamed Best Week Ever with Paul F. Tompkins. He is also the host of The Pod F. Tompkast, which was ranked #1 by Rolling Stone on their list of ""The 10 Best Comedy Podcasts of the Moment"" in 2011. Tompkins' comedy career has included stand-up, sketch comedy and a variety of other live performances. Tompkins stand-up comedy performances are of a storytelling and observationalist style. His shows often consist of extended riffs and long anecdotes. Tompkins deals topics of the bizarre and the absurd — such as a rant about peanut brittle, a discussion about cake versus pie, and smashed coins — in addition to recounting stories about his own life experiences and family. His comedic style has been described as alternative comedy; Tompkins has stated that he is not bothered by the label and that he likes the term. Tompkins is known for his style of dress during his live comedic performances, always performing in suit and tie, sometimes in pinstripes and with a bowtie; his look has been described by some in the press as ""dapper"". Tompkins has described his look as ""foppish"" and ""just this side of Cedric the Entertainer."" Tompkins is based in Los Angeles and performs regularly in the city. Since 2002 he has performed a monthly show called The Paul F. Tompkins Show at Largo, an L.A. nightclub and cabaret. His show has featured such guests such as Fiona Apple, Jack Black, Dave Foley, Zach Galifianakis, Ed Helms, Aimee Mann and Weird Al Yankovic. Since its inception in 2005, Tompkins has taken part in the Thrilling Adventure Hour, a staged production in the style of old-time radio that is also held monthly at Largo. The show began podcasting in January 2011; in October of that same year the show's podcasts moved to the Nerdist Industries podcast network created by Chris Hardwick. Tompkins is a member of the Upright Citizens Brigade Theatre (UCB) Los Angeles. His comedy album ""Impersonal"" was recorded live at the UCB Theatre. He also performs monthly at the ""Dead Authors"" show at UCB Theatre in support of the nonprofit organization 826LA; Tompkins plays the role of H.G. Wells who serves as the host of the show. Tompkins has toured in the US and Canada and prefers to perform in independent venues, rather than conventional comedy clubs. Starting in 2009 he embarked on his ""Tompkins 300"" tour; Tompkins had been preparing for his one-hour Comedy Central special You Should Have Told Me at the Laughing Skull Lounge theatre in Atlanta, Georgia — a small theatre that seats about 74 people. In order to fill the seats for the his recording of his special, Tompkins required about 280 people in the audience over the course of 4 nights for the recording of his show. Tompkins decided to announce on Twitter that he needed 300 people to fill the seats each night; Bob Kerr, a Canadian comedian, saw the Twitter post and asked if Tompkins would like to perform in Toronto. Tompkins advised Kerr that if he was able to get 300 people to state that they would definitely see his show he would come to Toronto. Kerr then started a Facebook group called “I Wanna See Paul F. Tompkins in Toronto” and managed to get 300 people to join. In October of that same year Tompkins performed at the The Rivoli theatre in Toronto, the same theatre in which the sketch comedy show The Kids in the Hall was filmed. Facebook groups were subsequently started in other North American cities and in 2010 he stated that he had stopped promoting his shows on the radio. In 2011 he said that the Facebook 300 groups had become his main method of booking comedy shows. Tompkins wrote and performed in his one-man show, Driven to Drink which aired on HBO in 1998. He appeared on 6 episodes of Late Night with Conan O'Brien between 1998 and 2008 as well as 2 episodes of Conan in 2011 and 2012. He has recorded three comedy albums: ""Impersonal"" in 2007, ""Freak Wharf"" in 2009, and ""Laboring Under Delusions"" in 2012. His stand-up appearances on the Comedy Central network include being featured in episodes of Comedy Central Presents in 2003 and 2007, hosting an episode of Live at Gotham in 2009, performing on John Oliver's New York Stand Up Show in 2010, and recording two original one-hour comedy specials — You Should Have Told Me which aired in 2010 and Paul F. Tompkins: Laboring Under Delusions in 2012. He also appeared in the RiffTrax live broadcast of House on Haunted Hill.",1967
Paul Mooney,Paul Gladney,USA,"Paul Gladney (born August 4, 1941), better known by the stage name Paul Mooney, is an American comedian, writer, social critic, television and film actor. He is best known for his appearances on Chappelle's Show and as a writer for the comedian Richard Pryor. Mooney was born in Shreveport, Louisiana, and moved to Oakland, California seven years later. His parents are George Gladney and LaVoya Ealy. Mooney was raised primarily by his grandmother Aimay Ealy, known among the family as ""Mama."" Mama coined the nickname Mooney, but never explained to him the meaning or inspiration of the name. Mooney became a ringmaster with the Gatti-Charles Circus. During his stint as ringmaster, he always found himself writing comedy and telling jokes, which would later help Mooney land his first professional work as a writer for Richard Pryor. Mooney wrote some of Richard Pryor's routines for his appearance on Saturday Night Live, co-wrote his material for the Live on the Sunset Strip, Bicentennial Nigger, and Is It Something I Said albums, and Pryor's film Jo Jo Dancer, Your Life Is Calling. As the head writer for The Richard Pryor Show, he gave many young stand-up comics, such as Robin Williams, Sandra Bernhard, Marsha Warfield, John Witherspoon, and Tim Reid, their first break into show business. Mooney also wrote for Redd Foxx's Sanford and Son, Good Times, acted in several cult classics including Which Way Is Up?, Bustin' Loose, Hollywood Shuffle, and portrayed singer/songwriter Sam Cooke in The Buddy Holly Story. He was the head writer for the first year of Fox's In Living Color, creating the character Homey D. Clown, played by Damon Wayans. Mooney later went on to play Wayans' father in the Spike Lee film Bamboozled as the comedian Junebug. Paul Mooney initially appeared in the sketches ""Ask a Black Dude"" and ""Mooney at the Movies"" on Comedy Central's Chappelle's Show. He later appeared as Negrodamus, an African American version of Nostradamus. As Negrodamus, Mooney ad-libbed the ""answers to life's most unsolvable mysteries"" such as ""Why do white people love Wayne Brady?"" (Answer: ""Because Wayne Brady makes Bryant Gumbel look like Malcolm X."") Mooney was planning to reprise his role as Negrodamus in the third season of the Chappelle's Show, before it was canceled. In 2006, Paul Mooney hosted the BET tribute to Black History Month titled 25 Most @#%! Moments in Black History. In this show, he narrated some of the most shameful incidents involving African Americans since 1980. The top 25 moments included incidents involving Marion Barry, Terrell Owens, Wilson Goode, Michael Jackson, Flavor Flav, Whitney Houston, and Tupac Shakur amongst others.",1941
Paul Provenza,Paul Provenza,USA,"Paul Provenza (born July 31, 1957) is an actor, comedian, filmmaker, and self-professed skeptic based in Los Angeles. Provenza was born and grew up in the Pelham Parkway section of the Bronx, New York City, and graduated in 1975 from the Bronx High School of Science. In high school, he started performing stand-up comedy, making his stage debut at age 17 at the original The Improv in Manhattan. He continued performing while attending the University of Pennsylvania, taking a year's leave of absence to study in London at the Royal Academy of Dramatic Arts. While at RADA, he joined a classical repertory theatre group, becoming one of few Americans to perform the role of Romeo on the London stage. He graduated in 1979 from the University of Pennsylvania, the year it awarded its first Theatre Arts degree. At Penn, he wrote for the Pennsylvania Punch Bowl and was a cast member of the Mask and Wig Club, where he has returned numerous times to perform in the annual Intercollegiate Comedy Festival. While working as a standup, Provenza also found work in both theatre and television, appearing on TV shows including Northern Exposure and Empty Nest. He received critical acclaim for his work on stage, with his performance in the Off-Broadway play Only Kidding! being nominated for a Drama Desk Award for Best Actor and winning the Theater World Award for Best Actor in a Play. He was the stand-up comedian opening act for Diana Ross for three years or more. He was honored with a caricature by the legendary Al Hirschfeld. He also is a frequent panelist on Wait Wait Don't Tell Me on National Public Radio",1957
Paul Reiser,Paul Reiser,USA,"Paul Reiser (born March 30, 1957) is an American comedian, actor, television personality, author, screenwriter and musician. He is most widely known for his role on the long-running television sitcom Mad About You. Reiser placed number 77 on Comedy Central's list of the 100 Greatest Stand-ups of All Time in 2004. The name of Reiser's production company, Nuance Productions, comes from one of his lines in the film Diner (explaining his discomfort with the word 'nuance').",1957
Paul Rodriguez,Paul Rodriguez,Mexico,"Paul Rodriguez (born January 19, 1955) is a Mexican-born American stand-up comedian and actor. Rodriguez considered becoming a lawyer, but instead went into comedy. His first shot at national fame, the ABC sitcom a.k.a. Pablo, was canceled after seven episodes. In 1988, Rodriguez replaced Bob Eubanks as host of The Newlywed Game. The show lasted one season before being canceled, During his Tenure as host of the Newlywed Game, The show began using the 1958 hit record Book of Love by The Monotones as the theme song. Rodriguez has starred in several feature films including, D.C. Cab, Born in East L.A., Tortilla Soup, Rat Race, and Ali. He directed and starred in the film A Million to Juan. Rodriguez has also performed voice-over roles on King of the Hill, Dora the Explorer and Beverly Hills Chihuahua. Many of his comedy specials involve serious issues for the Latino community, and Rodriguez is known for his charity work. He has performed on several Comic Relief charity specials. In 1995, he performed a comedy television special live at San Quentin State Prison. He produced and was featured on the 2002 comedy special titled The Original Latin Kings of Comedy. In 2004, Comedy Central ranked him 74th on its list of the 100 Greatest Standups of all Time. Rodriguez also has an interest in farming with operations in California's Central Valley. He is the chairman of the California Latino Water Coalition, a group trying to draw attention to California's dire water situation. He also had a night show called El Show de Paul Rodriguez on Univision in the early 1990s. Rodriguez currently stars in the comedy-reality series 'Mis Videos Locos' on MTV Tr3s.",1955
Paula Poundstone,Paula Poundstone,USA,"Paula Poundstone (born December 29, 1959) is an American stand-up comedian. Paula Poundstone started doing stand-up comedy at open-mic nights in Boston in 1979. She characteristically performs dressed in a suit and tie. In 1984, Poundstone was cast in the movie Hyperspace but she did not further pursue an acting career. Instead, she continued as a comedian and began appearing on several talk shows. In 1989, she won the American Comedy Award for ""Best Female Stand-Up Comic."" In 1990, she wrote and starred in an HBO special called Cats, Cops and Stuff, for which she won a CableACE Award. She worked as a political correspondent for The Tonight Show during the 1992 US Presidential campaign and did the same for The Rosie O'Donnell Show in 1996. In 1993, Poundstone won a second CableACE Award, and began writing the column, ""Hey, Paula!"" for Mother Jones (1993–1998). Paula featured in her own variety show, The Paula Poundstone Show, on ABC (which lasted only two episodes). She was also a regular panelist for the game shows Hollywood Squares and To Tell the Truth, and NPR's Wait Wait... Don't Tell Me! Poundstone has also worked as a voice actress. She voiced Judge Stone on Science Court (also known as Squigglevision), an edutainment cartoon series done in the Squigglevision style that aired on Saturday mornings on ABC Kids in 1997. Staying with the makers of Science Court, Tom Snyder Productions, she was the voice of the mom, Paula Small, in the cartoon series Home Movies for the show's first five episodes, which aired on UPN. Between the show's 1999 UPN cancellation and 2000 revival on Cartoon Network, Paula chose to leave the show. The show's character, Paula Small, was named and loosely modeled around Poundstone. Paula is #88 on Comedy Central's 2004 list of the 100 greatest stand-ups of all time, and #7 on Maxim magazine's list of ""Worst Comedians of All Time."" She had her own Bravo special as part of their three-part Funny Girls series, along with Caroline Rhea and Joan Rivers, titled ""Look What the Cat Dragged In."" Around the same time as her Bravo special, Poundstone released her first book, There Is Nothing in this Book That I Meant to Say. Described as an autobiography that is ""part memoir, part monologue,"" the book intertwines historical biographies with anecdotes from her own life. Poundstone currently works as a panelist on the radio news quiz show Wait Wait... Don't Tell Me! on National Public Radio. She is also a regular guest on A Prairie Home Companion, appearing in Los Angeles shows and at joke shows. Poundstone released her first comedy CD, ""I Heart Jokes,"" in 2009.",1959
Pauly Shore,Paul Montgomery Shore,USA,"Paul Montgomery ""Pauly"" Shore (born February 1, 1968) is an American comedian and actor who starred in several comedy films in the 1990s and hosted a video show on MTV in the late 1980s and early 1990s. Shore is still performing stand-up comedy and toured in 2012. Shore was born Paul Montgomery Shore, the son of Mitzi Shore (née Saidel), who founded The Comedy Store, and Sammy Shore, a comedian. Shore was raised Jewish, and grew up in Beverly Hills, California. He graduated from Beverly Hills High School in 1986. Inspired by his parents' work in comedy and show business, a 17-year-old Shore made his stand-up debut at the Alley Cat Bistro in Culver City. ""Everyone else in school was filling out their SAT applications, but I just passed mine back. I knew I wasn't going to go to college."" Shore was mentored by Sam Kinison and opened several of his sets. While touring the comedy club circuit, Shore cultivated an alter ego persona, ""The Weasel"". ""The Weasel"" involved Shore speaking in a Jeff Spicoli-esque surfer parlance, heavily peppered with dudespeak slang such as ""edged"", ""melons"" and ""grinding"" as well as his catchphrase, ""Hey, BU-DDY.""",1968
Pete Correale,Pete Correale,USA,"Recently named by Entertainment Weekly as one of the top 10 comics to watch, rapidly rising comedy sensation Pete Correale brings his keen eye for the humor found in daily life to Comedy Central with his first-ever special, ""The Things We Do For Love."" Praised for his ""brash and energetic"" humor by the Anchorage Daily News, Correale is a veteran of the comedy club and festival circuit as well as television talk shows like ""The Tonight Show with Jay Leno,"" ""Late Night with David Letterman"" and ""Last Call with Carson Daily,"" and co-hosted the Sirius satellite radio show ""Breuer Unleashed"" with former ""Saturday Night Live"" star Jim Breuer for four years. The Long Island native began his comedy career after graduating from college in 1992 and moving to New York City, where he cooked hamburgers and mopped floors at the New York Comedy Club in exchange for stage time late in the night to hone his act. He quickly rose to headliner status a nd began making his living as a comedian.",1992
Phyllis Diller,Phyllis Ada Driver,USA,"Phyllis Diller (July 17, 1917 – August 20, 2012) was an American actress and comedienne. She created a stage persona of a wild-haired and eccentrically dressed housewife who made self-deprecating jokes about her age and appearance, her terrible cooking, and a husband named ""Fang"", while pretending to smoke from a long cigarette holder. Diller's signature was her unusual laugh. Diller was born Phyllis Ada Driver in Lima, Ohio, the daughter of Frances Ada (January 12, 1881 – January 26, 1949) and Perry Marcus Driver (June 13, 1862 – August 12, 1948), an insurance agent. She had German and Irish ancestry (the surname ""Driver"" had been changed from ""Treiber"" several generations earlier). Her mother was about twenty years younger than her father. Diller was raised a Methodist. Diller attended Lima's Central High School, then studied piano for three years at the Sherwood Music Conservatory of Columbia College Chicago before transferring to Bluffton College, where she met fellow ""Lima-ite"" and classmate Hugh Downs. Diller was a housewife, mother, and advertising copywriter. During World War II, Diller lived in Ypsilanti, Michigan, while her husband worked at the historic Willow Run Bomber Plant. In the mid-1950s, she made appearances on The Jack Paar Show and was a contestant on Groucho Marx's quiz show You Bet Your Life. Although she made her career in comedy, Diller had studied the piano for many years. She decided against a career in music after hearing her teachers and mentors play with much more skill than she thought that she would be able to achieve. She still played in her private life, however, and owned a custom-made harpsichord.",1917
Pigmeat Markham,Dewey Markham,USA,"Dewey ""Pigmeat"" Markham (April 18, 1904 – December 13, 1981) was an African-American entertainer. Though best known as a comedian, Markham was also a singer, dancer, and actor. His nickname came from a stage routine, in which he declared himself to be ""Sweet Poppa Pigmeat."" He was sometimes credited in films as David ""Pigmeat"" Markham. He was born in the community of Hayti, Durham, North Carolina. His family was the most prominent on their street, which came to be called (and later officially named) Markham Street in the Hayti District. Markham began his career in traveling music and burlesque shows. For a time he was a member of Bessie Smith's Traveling Revue in the 1920s. Later, he claimed he originated the Truckin' dance which became nationally popular at the start of the 1930s. In the 1940s he started making film appearances. In 1964 he recorded ""Open the Door, Richard"". Markham was a familiar act at New York's famed Apollo Theater where he wore blackface makeup and huge painted white lips, despite complaints the vaudeville tradition was degrading. He probably played at the Apollo more frequently than any other performer. Starting in the 1950s Pigmeat Markham began appearing on television, making multiple appearances on The Ed Sullivan Show. His boisterous, indecorous ""heyeah (here) come da judge"" schtick, which made a mockery of formal courtroom etiquette, became his signature routine. Markham would sit at an elevated judge's bench (often in a black graduation cap-and-gown, to look more impressive), and deal with a series of comic miscreants. He would often deliver his ""judgments"", as well as express frustration with the accused, by leaning over the bench and smacking the accused with an inflated bladder-balloon. He had hit comedy recordings in the 1960s on Chess Records, and saw his routine's entry line become a catchphrase on the Rowan & Martin's Laugh-In television show, as did his phrase ""Look that up in your Funk and Wagnalls"". Markham's most famous routine was ""discovered"" by the general public only after Sammy Davis, Jr. had performed it as a guest on Laugh-In. Due to the years of racial segregation in the entertainment world, he was not widely known by white audiences, and had almost exclusively performed on the ""chitlin' circuit"" of vaudeville, theatres, and night clubs and appeared in several race films, including William D. Alexander's 1949 revue film Burlesque in Harlem, which documented the chitlin' circuit. The success of Davis's appearance led to Markham's opportunity to perform his signature Judge character during his one season on Rowan & Martin's Laugh-In. Archie Campbell later adapted Markham's routine, performing as ""Justus O'Peace,"" on the country version of Laugh-In, Hee Haw, which borrowed heavily from the minstrel show tradition. Thanks to his Heyeah come da judge routine, which originally was accompanied by music with a funky beat, Pigmeat Markham is regarded as a forerunner of rappers. His song ""Here Comes The Judge"" peaked at number 19 on the Billboard and other charts in 1968. He published an autobiography, Here Come the Judge!, in the wake of his Laugh-In success. Markham has been cited as one of the progenitors of rap music.",1904
Ralphie May,Ralphie D. May,USA,"Ralphie O. May (born February 17, 1972) is an American stand-up comedian. May was born in Chattanooga, Tennessee, but raised in Clarksville, Arkansas. When he was seventeen years old, he won a contest to open for comedian Sam Kinison, whom he considered his idol.[1] Kinison suggested he move to Houston, Texas to further develop his comedy routine. May then studied at the High School for the Performing and Visual Arts in Houston and graduated. He then moved to Los Angeles to pursue a career in entertainment. In 2003, May was chosen to participate in the first season of Last Comic Standing. He finished in second place in the competition, with Dat Phan winning first place. After that, he started appearing in numerous comedy shows like The Wayne Brady Show and The Tonight Show with Jay Leno. In 2005, he was the only white comedian to perform on The Big Black Comedy Show, which also featured Mo'Nique, Rodman, and Vince Morris. In 2005, May released his comedy album, Just Correct. Since then, he has recorded four Comedy Central specials: Girth of a Nation (2006), Prime Cut (2007), Austin-tatious (2008), and Too Big To Ignore (2012). He has also appeared on films like For Da Love of Money. He also performed at the ""Gathering of the Juggalos 2012.""",1972
Ray Romano,Raymond Albert Romano,USA,"Raymond Albert ""Ray"" Romano (born December 21, 1957) is an American actor, stand-up comedian, screenwriter and voice actor, best known for his roles on the sitcom Everybody Loves Raymond and in the Ice Age film series. He recently starred in the TNT comedy-drama Men of a Certain Age. His early comedy career started when he competed in the Johnnie Walker Comedy Search in 1989. His career included many outlets, such as Comedy Central, where he had been a recurring guest voice on the show Dr. Katz, Professional Therapist. He also was a contestant on Star Search in the stand-up comedy category. He originally was cast to play Joe (originally named Rick) on the American television sitcom NewsRadio, but was fired and replaced by Joe Rogan. He then appeared on Late Show with David Letterman doing his stand up routine which formed his ties with CBS. Shortly thereafter, he became the star of his own show, Everybody Loves Raymond on CBS, that featured a cast and format more suitable to Romano's brand of humor. Romano and his comedian friend, Kevin James, starred in the salesman comedy, Grilled, as two guys of the same profession who are both very desperate to land a big sale. Romano was featured on a 2000 episode of Who Wants to Be a Millionaire, on which he won US$125,000 for the NYPD's D.A.R.E. Unit. His older brother, Richard Romano (born in 1956), is a sergeant with the NYPD, and he has a younger brother, Robert Romano (born 1965). In 2001, Romano was named one of E!'s top twenty entertainers of the year. That same year he was featured with his brother (a teacher at a school in Long Island) on a New York Police Department recruiting poster. In 2004 he became the highest-paid television actor in history for his role of Raymond on CBS's Everybody Loves Raymond. It was later revealed on E! that he had broken another record by his show having the highest revenue at US$3.9 billion.",1956
