comedian,full_name,country,bio,birth_year
John Pinette,John Pinette,USA,"John Pinette (born March 23, 1964) is an American actor and stand-up comedian. He has toured the comedy club circuit since the 1980s and has appeared in cinema and television. Besides stand-up, Pinette does impressions of The Chipmunks, Elvis Presley, Gollum from The Lord of the Rings, Hervé Villechaize (Tattoo from Fantasy Island), an Ewok, actor Marlon Brando (notably Brando's role in The Godfather), as well as various ethnic accents. He occasionally sings, for example ""Over the Rainbow"" from The Wizard of Oz, in stand-up routines. John was born in Boston, Massachusetts and graduated from Malden Catholic High School in 1982. He started a career in accounting, but on the advice of friends left to pursue a career in comedy. He got a break when asked to tour with Frank Sinatra. Pinette is a regular guest on The Tonight Show and The View. Pinette was in Duets, Dear God, and Junior. He was a regular on the series Parker Lewis Can't Lose, and starred as the carjack victim in the final episode of Seinfeld. In 2004, Pinette was Bumpo in Artisan Entertainment’s The Punisher, starring Thomas Jane and John Travolta. Pinette was named Stand-Up Comedian of the Year by the American Comedy Awards in 1999 and received a Gemini Award nomination for his televised performance at Montreal's Just for Laughs Comedy Festival in 2000. In 2004, Pinette joined the touring cast of the musical Hairspray in the role of Edna Turnblad. He later went on to the Broadway production in 2005, and continued in the role until May 28, 2006. In his 2006 concert I'm Starvin', he said it was the first musical theater production he had been in since high school. In 2004, Pinette's stand up material was featured in Comedy Central's animated series Shorties Watchin' Shorties. In 2007, Pinette performed at the 42nd annual MDA Jerry Lewis Telethon. He performed at the Edinburgh Comedy Festival in Edinburgh, Scotland in 2008, and toured in cities in 2010 beginning in April. During this tour, Pinette recorded a Comedy Central special entitled ""John Pinette: Still Hungry"". The taping took place at the Vic Theatre in Chicago, Illinois. The world premiere of ""John Pinette: Still Hungry"" was on July 29, 2011, on Comedy Central. In 2012, Pinette was one of the comedy acts in Ron White's Comedy Salute To The Troops on CMT.",1964
Johnny Carson,John William Carson,USA,"John William ""Johnny"" Carson (October 23, 1925 – January 23, 2005) was an American television host and comedian, known for thirty years as host of The Tonight Show Starring Johnny Carson (1962–1992). Carson received six Emmy Awards, the Governor Award, and a 1985 Peabody Award. He was inducted into the Television Academy Hall of Fame in 1987. Johnny Carson was awarded the Presidential Medal of Freedom in 1992 and received a Kennedy Center Honor in 1993. Although his show was already successful by the end of the 1960s, during the 1970s Carson became an American icon and remained so until his retirement in 1992. He adopted a casual, conversational approach with extensive interaction with guests, an approach pioneered by Arthur Godfrey and previous Tonight Show hosts Steve Allen and Jack Paar. Late night hosts David Letterman, Jay Leno, Conan O'Brien, Craig Ferguson, and Jimmy Fallon have all cited Carson's influence on their late-night talk shows, which resemble his in format and tone.",1925
Jon Stewart,Jonathan Stuart Leibowitz,USA,"Jon Stewart (born Jonathan Stuart Leibowitz; November 28, 1962) is an American political satirist, writer, television host, actor, media critic and stand-up comedian. He is widely known as host of The Daily Show, a satirical news program that airs on Comedy Central. Stewart started as a stand-up comedian, but branched into television as host of Short Attention Span Theater for Comedy Central. He went on to host his own show on MTV, called The Jon Stewart Show, and then hosted another show on MTV called You Wrote It, You Watch It. He has also had several film roles as an actor. Stewart became the host of The Daily Show on Comedy Central in early 1999. He is also a writer and co-executive-producer of the show. After Stewart joined, The Daily Show steadily gained popularity and critical acclaim, resulting in his sixteen Emmy Awards. Stewart has gained acclaim as an acerbic, satirical critic of personality-driven media shows, in particular those of the US media networks such as CNN, Fox News Channel, and MSNBC. Critics say Stewart benefits from a double standard: he critiques other news shows from the safe, removed position of his ""fake news"" desk. Stewart agrees, saying that neither his show nor his channel purports to be anything other than satire and comedy. In spite of its self-professed entertainment mandate, The Daily Show has been nominated for news and journalism awards. Stewart hosted the 78th and 80th Academy Awards. He is the co-author of America (The Book): A Citizen's Guide to Democracy Inaction, which was one of the best-selling books in the U.S. in 2004 and Earth (The Book): A Visitor's Guide to the Human Race released in 2010.",1962
Jonathan Katz,Jonathan Paul Katz,USA,"Jonathan Paul Katz (born December 1, 1946) is an American comedian, actor, and voice actor best known for his starring role in the animated sitcom Dr. Katz, Professional Therapist. He produces a podcast titled Hey, We're Back and can be heard on Explosion Bus. Katz's father was an immigrant from Budapest, Hungary. He is a close friend of playwright David Mamet, with whom he attended Goddard College. Katz co-wrote House of Games with Mamet and had small roles in the Mamet-directed films Things Change, Homicide, The Spanish Prisoner and State and Main. Katz and Mamet used to travel from college to college hustling people at ping-pong. Katz was the New York ping-pong champion in 1964. He would let Mamet beat him. They would pretend to play for money, and then Mamet would say to a mark, ""If you want to play me, you have to beat my friend first."" To keep the game moderately close, Katz would sometimes spot his opponents 15 points and during every point recall a painful experience from his childhood. Originally a musician and songwriter, Katz fronted a rhythm and blues group called ""Katz and Jammers"" before serving as the musical director for Robin Williams's 1979 stand-up tour. In 1998, he released a blues album titled Brandon Project. In 1996, Katz was diagnosed with multiple sclerosis. The initial symptoms began in 1996: ""I was working on a TV show called Ink with Ted Danson, and after every episode we would take a curtain call and I noticed that I needed a head-start."" Over time, he found it difficult to hide his physical condition behind his jokes: ""I was producing a show, and it was too physical a job for me to get from one location to another and I had to pretend I could keep up with everybody. My manager and attorney said, 'In Hollywood you can't be old or sick.' "" Hiding his condition became too much of a burden for Katz and he eventually disclosed it. Now he speaks publicly as part of a tour sponsored by a manufacturer of medications used to treat MS: ""People have been pretty supportive; nobody ever had me in mind for an action film because of the kind of work I do -- mostly in the world of animation, which is not a big issue because as a person, I can't run that fast; as a cartoon character, I can fly -- literally."" Katz, who now gets around with the help of a motorized scooter and performs on stage with the aid of a cane, says he doesn't regret his decision: ""One of the reasons I disclosed my condition is because it is much easier to live with MS than to pretend you don't have it. If I could convince everyone of that, my job here is done."" Dr. Katz originally aired on Comedy Central from 1995 to 2002, and starred Katz as a professional therapist whose patients were chiefly other comedians and actors. He received a Primetime Emmy Award for his work on the show in 1995 for Outstanding Voice-Over Performance. His voice can also be heard in the animated series Home Movies, a show with many ties to Dr. Katz, as well as on the Adult Swim animated comedy series ""Squidbillies"", where he performed uncredited voice-overs as ""The Rapist"" in Season 2 and as the Holodeck Therapist in Season 5. In 2007, Katz joked to Blast Magazine entertainment editor Bessie King about the success of his Comedy Central show and the recent release of the full series on DVD. ""I’m so proud of that work and I’m a compulsive name dropper, when I did a movie with Ice Cube over the summer I said...I hope my best work is not behind me but if it is, I’m glad it's Dr. Katz,"" he said. In 2007, he released a stand-up album titled Caffeinated. In 2009, he can be seen (or heard) as Freezy, the Burl Ives-inspired animated snowman star of Turbocharge: The Unauthorized Story of the Cars, a comedy biopic about The Cars, which Katz narrates throughout. In 2011, he starred as Jon Gold on the web series Explosion Bus created by Tom Snyder and co-developed with Katz, Snyder and Tom Leopold. In the spring of 2012, Katz taught a theater class at Brandeis University in Short Form Comedy.",1946
Jonathan Winters,Jonathan Harshman Winters III,USA,"Jonathan Harshman Winters III (born November 11, 1925) is an American comedian, actor, and artist. Winters was born in Bellbrook, Ohio, the son of Alice Kilgore (née Rodgers), a radio personality, and Jonathan Harshman Winters II, an investment broker. He is a descendant of Valentine Winters, founder of the Winters National Bank in Dayton, Ohio (now part of JPMorgan Chase). Of English and Scotch-Irish ancestry, Winters has described his father as an alcoholic who had trouble holding a job. When he was seven, his parents separated, and Winters' mother took him to Springfield, Ohio to live with his maternal grandmother. At age 17, Winters quit high school and joined the United States Marine Corps and served two and a half years in the Pacific Theater during World War II. Upon his return he attended Kenyon College. He later studied cartooning at Dayton Art Institute, where he met Eileen Schauder, whom he married in 1948. He began comedy routines and acting while studying at Kenyon College in Gambier, Ohio. He was also a local radio personality on WING (mornings, 6 to 8) in Dayton, Ohio and at WIZE in Springfield, Ohio. He performed as Johnny Winters on WBNS-TV in Columbus, Ohio for two and a half years, quitting the station in 1953 when they refused him a $5.00 raise. After promising his wife that he would return to Dayton if he did not make it in a year, and with $56.46 in his pocket, he moved to New York City, staying with friends in Greenwich Village. After obtaining Martin Goodman as his agent, he began stand-up routines in various New York nightclubs. His big break occurred (with the revised name of Jonathan) when he worked for Alistair Cooke on the CBS Sunday morning show Omnibus. In 1957, he performed in the first color television show, a 15-minute routine sponsored by Tums. In 1999, Winters was awarded the Mark Twain Prize for American Humor. He now lives near Santa Barbara, California, and is often seen browsing and hamming for the crowd at the antique show on the Ventura County fairgrounds. He often entertains the tellers and other workers whenever he visits his local bank to make a deposit or withdrawal. He spends time painting, and has had many gallery showings and been presented in one-man shows of his art. In 1987, he published Winters' Tales: Stories and Observations for the Unusual.",1925
Josh Blue,Josh Blue,Cameroon,"Josh Blue (born November 27, 1978) is an American comedian. He was voted the Last Comic Standing on NBC's reality show Last Comic Standing during its fourth season, which aired May–August 2006. Blue has cerebral palsy, and much of his self-deprecating humor is centered on this. Blue was born in Cameroon, where his father, Walter Blue, a professor of Romance languages from Hamline University, was teaching in a mission. Blue grew up in Saint Paul, Minnesota and graduated from Como Park Senior High School in 1997. He began his career as a comedian while seeking a creative writing degree at The Evergreen State College. Blue got his start in comedy doing open mic sets while attending The Evergreen State College. Audiences reacted enthusiastically to his self-deprecating humor, and Blue started making a name for himself on the comedy circuit. In 2002, he won the prestigious Comedy Works New Talent Search contest. He has appeared several times on Comedy Central's Mind of Mencia. Blue won $10,000 for finishing in first place at 2004 Las Vegas Comedy Festival's 2004 Royal Flush Comedy Competition. He was the first comedian to do stand-up on The Ellen DeGeneres Show. His other television credits include Live with Regis and Kelly, Comics Unleashed, plus numerous appearances on Fox, CBS, ABC, and MSNBC. He appeared in the 2009 low budget horror film Feast 3: The Happy Finish. Josh was voted the 13th best comedian by viewers in Comedy Central's Stand-up Comedy Showdown 2010. Blue was voted the 11th best comedian by viewers in Comedy Central's Stand-up Comedy Showdown 2011. He appeared in Ron White's Las Vegas Salute to the Troops 2013 as part of the opening act.",1978
Judah Friedlander,Judah Friedlander,USA,"Judah Friedlander (born March 16, 1969) is an American actor and comedian, best known for playing the role of writer Frank Rossitano on the NBC sitcom 30 Rock. Friedlander is also known for his role as Toby Radloff in the film American Splendor, a role garnered him favorable reviews and a nomination for best supporting actor at the 2004 Independent Spirit Awards. Earlier in his career he was recognized as ""the hug guy"" from the music video for the 2001 Dave Matthews Band single ""Everyday"". Friedlander is known for his distinctive look, which includes oversized glasses, shaggy hair, a t-shirt and trucker hat — often emblazoned with bombastic slogans such as ""World Champion"" — and a generally unkempt appearance. It is a look he maintains as a stand-up comedian, during most of his public appearances, and which he has employed in some of his acting roles. Friedlander was born in Gaithersburg, Maryland, the son of Shirley and Art Friedlander. His father was of Russian Jewish descent and his mother, a native of Pittsburgh, is Croatian American. As a child, Friedlander drew political cartoons and made animated films. He first tried stand-up comedy in 1989 at the age of 19 while attending New York University. Friedlander has performed stand-up comedy regularly throughout his entertainment career. He continued to perform stand-up several nights a week in New York City while working on the sitcom 30 Rock. Friedlander has stated that he is most relaxed when doing stand-up and that he considers stand-up to be his first true love, preferring it to acting. He stated in 2012 that stand-up comedy is ""still the most important thing I do from an artistic standpoint."" Friedlander has cited comedians Steven Wright, Sam Kinison and John Mulrooney as influences. He also says that Dave Attell is one of his favorite comics. Friedlander's comedic performances often feature him making outrageous and bombastic claims about himself with a deadpan delivery. Many of these claims are reflected in slogans displayed on the many trucker hats he wears — the most common being ""World Champion"", a slogan he has worn in various languages. One of his claims include being an expert in karate, having achieved an ""extra-dark black belt"" in the sport. In 2010, he authored the humor book How to Beat Up Anybody: An Instructional and Inspirational Karate Book by the World Champion. Friedlander's claims provide comedic irony when contrasted against his nonchalant attitude and physical appearance. Friedlander wears large, thick-rimmed glasses, is often unshaven and is generally unkempt. His physique has also been described as ""doughy"". The look that Friedlander employs during his stand-up has also carried over into some of his television and film roles, including his 30 Rock role as TV writer Frank Rossitano. Frank is however much lazier than Friedlander's ""World Champion"" personae. In 2007, Heeb magazine included Friedlander in their list of ""100 people you need to know about"".",1969
Judy Gold,Judy Gold,USA,"Judy Gold (born November 15, 1962) is an American stand-up comic. She won two Daytime Emmy Awards for her work as a writer and producer on The Rosie O'Donnell Show. She has also been involved in many projects in various roles, including the television series All American Girl and HBO At the Multiplex segments where she asks humorous questions of unexpecting moviegoers. She first did stand-up on a dare while in college at Rutgers University. She is a lesbian, shared a relationship with her former partner, Sharon, for almost 20 years, and has two children (Henry, 1996, and Ben, 2001), facts she frequently referenced in her comments on the show Tough Crowd with Colin Quinn. Gold is very active in both LGBT and Jewish communities. She was active in support of the 2004 and 2008 Democratic presidential campaign. Her one-woman show 25 Questions for a Jewish Mother, co-written with Kate Moira Ryan, is based on a series of interviews with more than 50 Jewish mothers in the United States. Their stories are interspersed with anecdotes about her own mother and her life as a lesbian mother of two sons. It ran at the Ars Nova Theater in New York City in early 2006 and reopened on October 12, 2006, at St. Luke's Theater. Judy Gold also appears as a commentator on truTV's TruTV Presents: World's Dumbest.... She has also started her own (as the show's producer, Meetinghouse Productions Inc., (which also produces World's Dumbest) calls it) docu-comedy series (the first episode of which can be viewed on YouTube) about herself, family, and friends. In 2007 she was featured in the film Making Trouble, a tribute to female Jewish comedians, produced by the Jewish Women’s Archive. In 2011, Gold was named a Givenik Ambassador.",1962
Judy Tenuta,Judy Tenuta,USA,"Judy Tenuta (born November 7, 1956) is an American entertainer, actress, comedienne, author, producer, and accordionist. One of nine siblings, Judy Lynn was born in Oak Park, Illinois in 1956 into a large Catholic family; to a Polish mother Joann, and an Italian father, Caesar, in Oak Park, Illinois. Tenuta's nephew, JP Tenuta, is a professional dancer who studied at Ailey and the Martha Graham School. Judy gained notoriety as a wisecracking, accordion-wielding self-proclaimed ""Petite Flower and Love Goddess"" during the golden age of character comedy in the mid '80s with such notable contemporaries as Sam Kinison and Steven Wright. She has been featured in several productions of ""Weird Al"" Yankovic, including The Weird Al Show and the music videos for ""Headline News"" and ""White & Nerdy"". She has also appeared on game shows such as Hollywood Squares and the 1998 revival of Match Game. Her most extensive profile came from a series of TV ads for MTV and most notably, Diet Dr. Pepper in the late-1980s, as well as her HBO, Showtime and Lifetime specials which became popular and gained her a loyal following. She is also well known for her often quoted catch phrase, ""It could happen!"" Her use of voice in her act has lent itself to voice-over work in several animated programs. This includes doing the voice of Edna on Duckman, Black Widow on Space Ghost Coast to Coast, and as herself in Dr. Katz, Professional Therapist. Tenuta's act is primarily structured around an exaggerated, offbeat persona that is referred to primarily as ""The Love Goddess"". Other monikers include ""The Petite Flower"", ""Aphrodite of the Accordion"", ""Fashion-Plate Saint"", ""Princess of Panty Shields"", and ""Empress of Elvis Impersonators"". Tenuta's persona encourages fans to convert to her own personal religion, ""Judyism"".",1956
Kathleen Madigan,Kathleen Madigan,USA,"Kathleen Madigan (born September 30, 1965) is an American comedian. Kathleen Madigan grew up in the St. Louis suburb of Florissant as one of seven children in a large Irish-American family. She attended McCluer North High School, where she displayed athletic skills by winning the Mid-Missouri Hoops Shoot Championship—at five-feet two-inches, she is the shortest person ever to do so. Following high school graduation in 1983, Madigan attended Southern Illinois University Edwardsville, earning a B.A. in Journalism in 1988. After college Madigan took a job in print journalism, working for the St. Louis-area Suburban Journals newspapers as well as the publications department of the Missouri Athletic Club. At the same time she would perform stand-up during ""open mic"" nights at St. Louis area comedy clubs. Less than two years later, Madigan gave up her jobs in Missouri and set out for California to try the world of comedy full-time. She has appeared on Last Comic Standing, I Love the 90s: Part Deux, I Love the '80s 3-D, and Celebrity Poker Showdown. She has also starred in her own HBO Half-Hour Comedy Special and a Comedy Central Presents special. She is a veteran of The Tonight Show with Jay Leno, Late Night with Conan O'Brien, Late Show with David Letterman, and The Bob and Tom Show. She also hosts a radio program on Blue Collar Comedy. In 1996, Madigan won ""Funniest Female Stand-Up Comic"" at the American Comedy Awards.",1965
Kathy Griffin,Kathleen Mary Griffin,USA,"Kathleen Mary ""Kathy"" Griffin (born November 4, 1960) is an American actress and comedian. Born in Oak Park, Illinois, she moved to Los Angeles in 1978, where she studied drama at the Lee Strasberg Theatre and Film Institute and became a member of the improvisational comedy troupe The Groundlings. In the 1990s, Griffin began performing as a stand-up comedian and also appeared as a guest star on several television shows. She achieved recognition in a supporting role on the NBC sitcom Suddenly Susan (1996–2000). Her breakthrough came on the Bravo reality show Kathy Griffin: My Life on the D-List (2005–2010), which became a ratings hit for the network and earned her two Emmy Awards for Outstanding Reality Program. Griffin has released five comedy albums, with all of them receiving Grammy Award nominations. Her first album, For Your Consideration (2008), made her the first female comedian to debut at the top of the Billboard Top Comedy Albums chart. In 2009, she released her autobiography Official Book Club Selection: A Memoir According to Kathy Griffin, which topped The New York Times Best Seller list. Griffin has taped numerous stand-up specials with HBO and Bravo. In the latter network, she has recorded 16 specials, breaking the record for the number of specials in any network. In 2011, she also became the first comedian to have four televised specials in a year. Besides her comedy career, she is an LGBT activist involved in causes such as same-sex marriage and the repeal of ""Don't ask, don't tell"". She has also participated in two USO tours. Influenced by acts such as Joan Rivers and Don Rickles, Griffin is known for her conversational style and controversial statements on celebrities, religion and sexuality. She is recognized as one of the top female comedians in the United States.",1960
Katt Williams,Micah S. Katt Williams,USA,"Micah S. Katt Williams (born September 2, 1973), better known as Katt Williams, is an American comedian, rapper and actor. He is best known for his role as Money Mike in Friday After Next. He is also known for his stint on Nick Cannon’s MTV improv show, Wild 'n Out, for playing the fictional character Bobby Shaw on the program My Wife and Kids, as well as providing the voice for the character ""A Pimp Named Slickback"" in The Boondocks. Williams started performing comedy in his Cincinnati neighborhood, Avondale, most notably appearing on BET's Comic View. He has also played supporting characters in movies such as First Sunday and Norbit, but is probably more widely recognized for his character Money Mike in the movie Friday After Next. He has also used the Money Mike stage name when rapping for songs by such artists as Baby Bash, The Game, and Suga Free. Williams has provided numerous skits and video appearances for artists such as Nick Cannon, DJ Drama, E-40, The Game, Lyfe Jennings, Lil Jon, Lil' Kim, Lil' Scrappy, Ludacris, Outkast, T.I., Cyrano Williams, Oprah Winfrey, Machine Gun Kelly, and others. He was a cast member on Wild 'n Out for several seasons; he voices ""A Pimp Named Slickback"" on the Adult Swim's The Boondocks; he plays himself as an onstage comedian in Grand Theft Auto IV; and Williams has appeared in several episodes of My Wife and Kids as character Bobby Shaw. He was also on Comedy Central Roast of Flavor Flav. On December 3, 2012 Williams announced the end of his stand-up comedy career, a day after a bizarre incident in Seattle that landed him in jail. However, just 3 days later, Williams announced he was coming out of retirement.",1973
