comedian,full_name,country,bio,birth_year
Don Rickles,Donald Jay Rickles,USA,"Donald Jay ""Don"" Rickles (born May 8, 1926) is an American stand-up comedian and actor. A frequent guest on The Tonight Show Starring Johnny Carson, Rickles has acted in comedic and dramatic roles, but is best known as an insult comic. It is well known that Rickles has nothing against the people that he insults during his routine, and that it is all just part of the act. Although sarcastically nicknamed ""Mr. Warmth"" due to his offensive and insensitive stage personality, in reality most know him to be actually quite genial and pleasant. It has been said that being insulted by Rickles is like ""wearing a badge of honor."" When asked by an interviewer if he ever worried that his insult comedy might ever become too offensive, Rickles replied, ""You know, every night when I go out on stage to do my comedy routines, there's always one nagging fear in the back of my mind. I'm always afraid that somewhere out there, there is one person in the audience that I'm NOT going to offend!"" Rickles is known for lackadaisically saying the word ""anyway"" and ""let me tell ya this,"" following most of his comedic insults, in order to appear nonchalant about the comic volley he had just thrown at an audience member, show host, etc. This is widely regarded as one of Rickles' classic comedic tactics that contribute to his impeccable sense of timing.",1926
Donald Glover,Donald McKinley Glover,USA,"Donald McKinley Glover (born September 25, 1983) is an American rapper, actor, writer, comedian, and producer. Glover first came to attention for his work with Derrick Comedy and for subsequently being a writer for 30 Rock. Today, he is best known for his role as college student Troy Barnes on the NBC comedy series Community and for his rising career as a stand-up comedian and rapper. In 2011, Glover signed to Glassnote Records under the stage name Childish Gambino after releasing several albums and mixtapes himself; his first album for the label, Camp, was released on November 15, 2011. Donald McKinley Glover was born in California, and raised in Georgia. His father is a postal worker and his mother runs a daycare center. His parents were also foster parents and Jehovah's Witnesses. Glover graduated from New York University's Tisch School of the Arts with a degree in Dramatic Writing in 2006 after attending DeKalb School of the Arts and Lakeside High School.",1983
Donnell Rawlings,Donnell M. Rawlings,USA,"Donnell M. Rawlings is an American comedian, actor and radio host, best known as a cast member on the Comedy Central sketch comedy TV series Chappelle's Show. Rawlings was born in Washington D.C. and grew up in Alexandria, Virginia. He grew up with his mother. Rawlings attended T.C. Williams High School in Alexandria, Virginia. He served in the United States Air Force stationed in South Korea and as Military Police on Bolling Air Force Base in Washington, D.C. in the late 1980s and early 1990s. Rawlings is most notable for frequently appearing in sketches on Chappelle's Show and hosting the third season along with Charlie Murphy. His catchphrase on the show was ""I'm rich, biaaaaach!"" (which is played at the end of every episode as part of Dave Chappelle's vanity card) as well as frequently adding ""Son!"" at the end of each sentence. He demonstrates his knowledge of the broken Korean he learned in the Air Force in the Chappelle's Show sketches ""Player Hater's Ball"" and ""The Time Haters"", the latter of which was featured in the ""Failures"" episode. Rawlings reprises his role as the hater ""Beautiful"", known for wearing a Jheri curl and a suit similar to ones that Little Richard has worn. In the sketches, he responds to the comments of Korean hater ""Mr. Roboto"" with insults in Korean. Rawlings stars in a series of sketch comedy clips portraying his character Ashy Larry, from Chappelle's Show, on heavy.com called ""From Ashy to Classy"". Ashy Larry dreams of how his life would be if he were classy, and dreams up a character who he calls Ashford Lawrence, a supposed reporter for heavy.com. Ashy Larry goes to different high class establishments posing as a reporter, where eventually his girl comes and pulls him out at the end of each clip. Rawlings also made appearances on the HBO drama The Wire playing Damien Lavelle 'Day-Day' Price, an ex-convict who is hired as a legislative aide and driver for corrupt state senator Clay Davis. Price's character appears unrefined on several occasions contemplating heists in public and stating things in the court room such as ""Y'all tryin' to 'criminate me"" while on the stand. Davis coincidentally enough is played by Chappelle's Show co-star Isiah Whitlock, Jr. Rawlings appears in Sam Raimi's Spider-Man 2 and a cameo appearance in the music video for Jim Jones' ""We Fly High"" (Ballin' Remix). He was a regular on The Ricki Lake Show mostly as a Judge on Various challenge episodes. In summer 2007, Rawlings was featured on the cover of the one-year anniversary issue of Beyond Race magazine. Rawlings was removed from his morning show post at Power 105's Ed Lover Show with Egypt and Ashy for a controversial comment the comedian made during the aftermath of the Don Imus controversy, responding to Ed Lover's comment ""That's a cheap black man, Nickel-Black"" with ""that's a Jewish black guy."" Rawlings was also a contestant in the Comedy Central show Reality Bites Back. He appeared in sketches on D.L. Hughley Breaks the News and in Howard Stern's Howard TV On Demand original series, Show in the Hallway. In July 2009, Rawlings recorded a clip imitating Stephon Marbury crying on his live webcast. Rawlings was a co-host on the Big Tigger Morning Show on Washington, D.C.'s radio station WPGC 95.5 from April 2010-January 2011. In 2011 Rawlings appeared on the MTV2 show Guy Code which he has done 2 seasons, as well as the show Hip Hop Squares.",1980
Doug Benson,Douglas Robert Benson,USA,"Douglas Robert ""Doug"" Benson (born May 7, 1964) is an American stand-up comedian and actor who has appeared on Comedy Central Presents, Best Week Ever and was a contestant on Last Comic Standing in the show's fifth season. In 2007, he starred in the film Super High Me, a documentary about marijuana usage. Benson also currently hosts the popular Doug Loves Movies podcast. His Comedy Central series The Benson Interruption ended its first season in December 2010 and was turned into a monthly podcast in January 2011. Benson was born and raised in San Diego, California. After attending Grossmont College, a community college in El Cajon, he moved to Los Angeles to pursue an acting career.",1964
Doug Stanhope,Douglas Gene Stanhope,USA,"Douglas Gene ""Doug"" Stanhope (born March 25, 1967) is an American stand-up comedian, actor and author known for his abrasive and controversial comedy style. He has made appearances at several major comedy festivals, including the Montreal Just For Laughs, US Comedy Arts Festival in Aspen, Colorado, the Chicago Comedy Festival and the Edinburgh Festival Fringe in Scotland, where he won the Strathmore Press Award in 2002. Stanhope was the winner of the 1995 San Francisco International Comedy Competition where he edged out Dane Cook in a three-week contest. In 2003 and 2004, Stanhope co-hosted the fifth and sixth seasons of The Man Show with Joe Rogan. He hosted his own radio show on SIRIUS Satellite Radio in 2005. That year, Stanhope hosted Girls Gone Wild: America Uncovered. When asked what it was like working with Girls Gone Wild creator Joe Francis, Stanhope admitted ""He's pure, unadulterated evil,"" and ""The most awful human being I've ever met in all of my time in the entertainment business."" He has established a group of touring comics known as The Unbookables featuring artists such as Andy Andrist, Sean Rouse, James Inman, Brett Erickson, Travis Lipski, Brendon Walsh, Norman Wilkerson, Kristine Levine, and Brian Potrafka. The Unbookables' first CD, Morbid Obscenity, also featuring Andrist, Rouse, Lynn Shawcroft, and Banjo Randy, released July 4, 2006, on Stand Up! Records. Stanhope appeared in the film The Aristocrats, telling a caustic joke to a baby. He was the subject of an 8-page feature in British GQ under the title ""Is This America's Most Depraved Man?"" by Robert Chalmers in 2006. In summer 2006, he was booked to appear on several bills at the Cat Laughs Comedy Festival in Kilkenny, Ireland; his extended bit saying that Irish men commit pedophilia because of the ugliness of Irish women earned a hostile reaction from the crowd, the press, and the festival organizers. He appeared alongside Rouse at the Festival Fringe in Edinburgh on August 2006 to 5-star reviews from the press. On his opening night he took what was believed to be an ecstasy tablet that was handed to him by a member of the audience. During his Edinburgh performance he included a segment that was perceived as anti-Semitic. Stanhope responded in his 2007 Showtime special, No Refunds, by elaborating on the incident. He self-published a book, Fun with Pedophiles: The Best of Baiting in October 2006, which includes several instances of his setting up a false Internet instant-messaging persona to offer sex, and then verbally abusing the ""baitee"" in a chat session that is logged to share with others. He discussed his self-published book and the philosophy behind it on Penn Jillette's radio show on San Diego's 97.1 FreeFM on November 22, 2006. In 2007, Stanhope made two TV specials—one in the US for Showtime, recorded at The Gotham Comedy Club in New York City on March 12; and one for the UK's Channel 4 Comedy Lab, filmed at the Caves in Edinburgh, Scotland titled ""Doug Stanhope: Go Home"". The Showtime special, titled No Refunds, premiered August 3 and was released on DVD August 14. His live show was voted ""Best Comedy Performance of the Year"" by Time Out New York for both 2006 and 2008. On September 25, 2008, Stanhope appeared as a guest panelist on the Channel 4 programme 8 Out of 10 Cats whilst touring in London. Stanhope lives in the Warren tract of Bisbee, Arizona, near the US–Mexico border in a small house with musician/author Amy ""Bingo"" Bingaman. His live show was placed in the top 5 of the 20 Best Live Shows of 2009 by London's The Guardian newspaper. Stanhope's 7th album, From Across The Street, was released on November 24, 2009. In 2010, Stanhope aired a series of vignettes during Newswipe with Charlie Brooker in the UK. In 2013 he did the same during ""Charlie Brooker's Weekly Wipe"". Stanhope is managed by Brian Hennigan. On November 17, 2010, Stanhope signed to rock and metal label Roadrunner Records to launch their new comedy label, Roadrunner Comedy. On May 3, 2011, the album was released: Oslo: Burning The Bridge To Nowhere. In cooperation with the mayor of Reykjavík, comedian Jón Gnarr, Stanhope scheduled a performance in Iceland's only maximum security prison, Litla-Hraun, for September 25, 2011. Fans who want to watch the show would have to commit a crime; for them he invented the Stanhope Defense. Stanhope appeared on the FX television show Louie as Eddie, a fictional comedian that Louis C.K. knew 20 years earlier when they first started performing, in the season 2 episode entitled ""Eddie,"" first aired on August 11, 2011.",1967
Dov Davidoff,Dov Davidoff,USA,"Dov Davidoff is an American comedian. Dov Davidoff is originally from Englishtown, NJ. In addition to performing regularly in clubs and colleges throughout the country, Davidoff also acted in Invincible with Mark Wahlberg, and also appears on TV shows On April 22, 2008, he released a CD entitled ""The Point Is.."" on Comedy Central Records.",2008
Drew Carey,Drew Allison Carey,USA,"Drew Allison Carey (born May 23, 1958) is an American actor, comedian, sports executive, and game show host. After serving in the U.S. Marine Corps and making a name for himself in stand-up comedy, Carey eventually gained popularity starring on his own sitcom, The Drew Carey Show, and serving as host of the U.S. version of the improv comedy show Whose Line Is It Anyway?, both of which aired on ABC. Carey has appeared in several films, television series, music videos, a made-for-television film, and a computer game. He has hosted the television game show The Price Is Right since 2007. He is interested in a variety of sports, has worked as a photographer at U.S. National Team soccer games, is a minority owner of the Major League Soccer team Seattle Sounders FC and a member of the WWE Hall of Fame. Carey has written an autobiography, Dirty Jokes And Beer: Stories Of The Unrefined, detailing his early life and television career. In 1985, he began his comedy career by following up on a suggestion by David Lawrence (a disc jockey friend who had been paying Drew to write jokes for David's radio show in Cleveland) to go to the library and borrow books on how to write jokes. The following year, after winning an open-microphone contest, he became Master of Ceremonies at the Cleveland Comedy Club. He performed at multiple comedy clubs over the next few years in both Cleveland and Los Angeles. He was first brought to the national eye as a comedian when he competed in the 1988 Star Search. Carey was working as a stand-up comedian when he appeared on The Tonight Show Starring Johnny Carson in November 1991. His performance that night impressed Carson, who invited Carey to the couch next to his desk; this was considered a rare honor for any comedian. In that same year, Carey joined the 14th Annual Young Comedians Special on HBO and made his first appearance on Late Night with David Letterman. In 1994, Carey wrote his own stand-up comedy special which aired on Showtime, entitled Drew Carey: Human Cartoon, for which he won a CableACE Award for Best Writing.",1958
Earthquake,Nathaniel Martin Stroman,USA,"Nathaniel Martin Stroman (born May 29, 1963), best known as ""Earthquake"", is an African-American actor, voice artist, and comedian. Earthquake performed a half-hour HBO special as part of the series One Night Stand, which first aired on August 26, 2005. He also had a small role in Kevin Smith's film Clerks II, and a supporting role in the film The Longshots. He had a recurring role as Chris' Uncle Mike, on Everybody Hates Chris. He voiced Root the Rooster in the 2006 CGI film, Barnyard and in the video game of the same title, and continues to do so on the TV series spinoff, Back at the Barnyard. Earthquake was in the U.S. Air Force for eleven years and had attained the rank of Sergeant. While stationed at Eglin Air Force Base in Ft. Walton Beach, Florida, Earthquake would take advantage of an Open Mic Night at the local bar, Top's and Blue's and discovered his comedic destiny on that stage. Earthquake revealed on The Howard Stern Show that while he was in the U.S. Air Force, he once dropped a live nuclear missile when he was loading it into an aircraft. According to Earthquake, the incident caused much panic and was classified as a Broken Arrow, a situation that alerts a large portion of the military, including the President of the United States. He claimed that he dropped the missile because he was rushing to attend a 2 Live Crew concert.",1963
Eddie Griffin,Edward Rubin Griffin,USA,"Edward ""Eddie"" Rubin Griffin (born July 15, 1968) is an American actor and comedian. He is best known for his sitcom Malcolm & Eddie along with co-star Malcolm-Jamal Warner, and his role in the 2002 comedy film Undercover Brother as the film’s title character. Griffin was born in Kansas City, Missouri and raised by his single mother, Doris Thomas, a phone company operator. After attending high school in Kansas City, he enrolled as a biological engineering major at Kansas State University, but left after three months. He was ranked at number 62 on Comedy Central's list of the 100 Greatest Stand-ups of All Time. In 2011 Comedy Central released You Can Tell 'Em I Said It on DVD. It was 82 minutes of unedited and uncensored content.",1968
Eddie Izzard,Edward John Izzard,Yemen,"Edward John ""Eddie"" Izzard (born 7 February 1962) is an English stand-up comedian, actor and writer. His comedy style takes the form of rambling whimsical monologue and self-referential pantomime. He had a starring role in the television series The Riches as Wayne Malloy and has appeared in many motion pictures such as Ocean's Twelve, Ocean's Thirteen, Mystery Men, Shadow of the Vampire, The Cat's Meow, Across the Universe, The Chronicles of Narnia: Prince Caspian and Valkyrie. He is also the voice of Nigel in the 2006 animated film The Wild and Miles Axlerod in the 2011 Disney/Pixar animated film Cars 2. Izzard has cited his main comedy role model as Monty Python and John Cleese once referred to him as the ""Lost Python"". In 2009, he completed 43 marathons in 51 days for Sport Relief in spite of having no prior history of long distance running. He is also known for his transvestism. He has won numerous awards including a Primetime Emmy Award for Individual Performance in a Variety or Music Program for his comedy special Dress to Kill, in 2000. Izzard's web site won the Yahoo People's Choice Award and earned the Webby Award. On 6 September 2012, Izzard presented the medals to the athletes who had won the 800m T54 race at the London2012 Paralympic Games - the gold medal went to Great Britain athlete Dave Weir.",1962
Eddie Murphy,Edward Regan Murphy,USA,"Edward Regan ""Eddie"" Murphy (born April 3, 1961) is an American stand-up comedian, actor, writer, singer, director, and musician. Box office takes from Murphy's films make him the second-highest grossing actor in the United States. He was a regular cast member on Saturday Night Live from 1980 to 1984 and has worked as a stand-up comedian. He was ranked #10 on Comedy Central's list of the 100 Greatest Stand-ups of All Time. He has received Golden Globe Award nominations for his performances in 48 Hrs, Beverly Hills Cop series, Trading Places, and The Nutty Professor. In 2007, he won the Golden Globe for Best Supporting Actor and received a nomination for the Academy Award for Best Supporting Actor for his portrayal of soul singer James ""Thunder"" Early in Dreamgirls. Eddie Murphy's work as a voice actor includes Thurgood Stubbs in The PJs, Donkey in the Shrek series and the dragon Mushu in Disney's Mulan. In some of his films, he plays multiple roles in addition to his main character, intended as a tribute to one of his idols Peter Sellers, who played multiple roles in Dr. Strangelove and elsewhere. Murphy has played multiple roles in Coming to America, Wes Craven's Vampire In Brooklyn, the Nutty Professor films (where he played the title role in two incarnations, plus his father, brother, mother, and grandmother), Bowfinger, Norbit, and Meet Dave.",1961
Ellen DeGeneres,Ellen Lee DeGeneres,USA,"Ellen Lee DeGeneres (born January 26, 1958) is an American stand-up comedian, television host and actress. She hosts the syndicated talk show The Ellen DeGeneres Show. DeGeneres has hosted both the Academy Awards and the Primetime Emmys. As a film actress, she starred in Mr. Wrong, appeared in EDtv and The Love Letter, and provided the voice of Dory in the Disney-Pixar animated film Finding Nemo, for which she was awarded a Saturn Award for Best Supporting Actress, the first and only time a voice performance won a Saturn Award. She was a judge on American Idol for one year, having joined the show in its ninth season. She also starred in two television sitcoms, Ellen from 1994 to 1998 and The Ellen Show from 2001 to 2002. During the fourth season of Ellen in 1997, DeGeneres came out publicly as a lesbian in an appearance on The Oprah Winfrey Show. Shortly afterwards, her character Ellen Morgan also came out to a therapist played by Winfrey, and the series went on to explore various LGBT issues including the coming out process. She has won thirteen Emmys and numerous other awards for her work and charitable efforts. In November 2011, Secretary of State Hillary Clinton named her a Special Envoy for Global AIDS Awareness.",1958
Emo Philips,Emo Philips,USA,"Emo Philips is an American entertainer and comedian born in the Chicago suburb of Downers Grove. Much of his standup comedy stems from the use of paraprosdokians and garden path sentences spoken in a wandering falsetto tone of voice and a confused, childlike delivery of his material to produce the intended comic timing in a manner invoking the 'wisdom of children' or the idiot savant. Philips has recorded three comedy albums. His album E=mo², recorded live at Caroline's in New York City, won the 1985 New Music Award for best comedy album. It was later re-released along with his Live at the Hasty Pudding Theatre album on a single CD. He also released an album called Emo in 2001. A joke of his was voted funniest religious joke ever in a 2005 online poll. In 2006, he appeared at the Newbury Comedy Festival. He was included in the top 50 of E4's 100 Greatest Comedians, and also appeared number 54 on Channel 4's top 100 greatest standups. Aside from Philips' long career as a standup comic, he has been featured in acting roles on television series such as Miami Vice and The Weird Al Show. He has also recently appeared on British television, appearing as a guest on the panel game 8 Out of 10 Cats. Philips has several voiceover credits, including work on the animated series Dr. Katz, Professional Therapist; Home Movies; Space Ghost: Coast to Coast; Adventure Time as Cuber the mysterious storyteller; and the voice of Dooper in the animated series Slacker Cats. He has appeared in feature films, including 1989's UHF (as a rather clumsy school shop teacher who accidentally saws his thumb off), the original 1992 version of Meet the Parents (also executive producer), and Desperation Boulevard in 1998.",1985
Eugene Mirman,Eugene Boris Mirman,Russia,"Eugene Boris Mirman (born July 24, 1974) is a Russian-born American comedian and writer. Mirman also played Yvgeny Mirminsky on Delocated, and voices Gene Belcher on the animated comedy Bob's Burgers. In 2004, Mirman released The Absurd Nightclub Comedy of Eugene Mirman, a CD/DVD on Suicide Squeeze Records. The album was voted one of the Best Albums of 2004 by both The A.V. Club and Time Out New York. His second album, En Garde, Society was released by Sub Pop in 2006. Three years later, Mirman released another comedy album titled God Is a Twelve-Year-Old Boy with Aspergers which was recorded in Chicago at the Lakeshore Theatre. Mirman has appeared at the U.S. Comedy Arts Festival in Aspen, Colorado, the Just for Laughs Festival in Montreal, Bumbershoot, and South by Southwest. He co-produced the weekly standup-variety show Invite Them Up with Bobby Tisdale and Holly Schlesinger, which won a Nightlife Award. He currently produces Pretty Good Friends (formerly Tearing the Veil of Maya) at Union Hall in Park Slope, Brooklyn with Julie Smith, which has been voted the best comedy night in New York City by New York Magazine. Mirman, much like David Cross and Patton Oswalt, is known to often perform in rock clubs and theaters as opposed to traditional comedy clubs. Often touring the United States, Mirman occasionally opens for the comedy troupe Stella (former members of The State). He has opened for various bands such as The Shins and toured with Modest Mouse, Yo La Tengo, Gogol Bordello, Andrew Bird, and Cake. Mirman also toured with Patton Oswalt, Brian Posehn and Maria Bamford on the Comedians of Comedy tour. He has toured as an opener for Flight of the Conchords and with Andy Kindler and Marc Maron in Stand Uppity. He plays the character Eugene in the Flight of the Conchords HBO television series. In January 2010, Mirman performed standup on the John Oliver's New York Stand Up Show on Comedy Central. Mirman's Eugene Mirman Comedy Festival has been running since 2008.",1974
Felipe Esparza,Felipe Esparza,Mexico,"Felipe Esparza is a comedian and actor, best recognized for his raw, real-life comedy that audiences everywhere can relate to. Known for his wild hair and his often-imitated phrase, ""what's up, fool?"", people are always surprised to find out that Felipe is also the same person referred to and imitated in several infamous stories by fellow comedian, Gabriel Iglesias. Felipe has most recently been seen as the winner of NBC's Last Comic Standing (2010) and is currently touring comedy clubs and theaters across the country. Felipe is a product of the streets of East Los Angeles (Boyle Heights, to be exact) and much of his material is the result of seeing the humor in the struggles of everyday life. Felipe got immediate television exposure, when he appeared on a Showtime, ""Diamonds in the Rough"" segment, just 1 1/2 years into his stand-up career. Since that time, he has appeared on numerous television shows, including ABC's ""Comics Unleashed"", Comedy Central's ""Premium Blend"" and ""Russell Simmons Presents Stand-Up at the El Rey"", Showtime's ""Comics Without Borders"", BET's ""Comic View"", and Galavisión's ""Que Locos"" (where he holds the title of most appearances by any comedian). In 2009, he appeared in his first two feature-length films, ""The Deported"", with Nick Turturro, Talia Shire, and Paul Rodriguez and a feature-length film based on his stand-up comedy called, ""I'm Not Like That No More"", where he stars opposite Paul Rodriguez. He recently wrapped production on his 1-hour stand-up special entitled ""They're Not Gonna Laugh at You"", which is scheduled to air on Showtime in fall, 2011.",2010
